{
  "$schema": "http://json-schema.org/draft-07/schema#",
  "$id": "ood-perceptionbench/golden/1",
  "title": "OOD-PerceptionBench golden bundle",
  "description": "Expected outputs for one smoke split, measured with a reference agent over several replicate runs. Written by tests/make_golden.py, consumed by tests/check_acceptance.py. Validated structurally by the harness (no third-party jsonschema dependency); this file is the normative description.",
  "type": "object",
  "required": ["schema", "bundle_version", "binds_to", "split", "reference_agent", "environment", "protocol", "tolerance", "generated", "routes"],
  "additionalProperties": false,
  "properties": {
    "schema": {"const": "ood-perceptionbench/golden/1"},
    "bundle_version": {
      "type": "string",
      "description": "Release bundle this golden is valid for, e.g. 'v0.9'. The harness rejects a mismatch: a golden is only valid for the content-pack version it was measured against.",
      "examples": ["v0.9"]
    },
    "binds_to": {
      "type": "string",
      "description": "arXiv version these numbers correspond to (coordinator standing rule 1).",
      "examples": ["arXiv v1"]
    },
    "reportable": {
      "const": false,
      "description": "Always false. Smoke-split scores must never be published as a benchmark result; six-to-nine routes cannot approximate a claim computed over 55 base routes."
    },
    "split": {
      "type": "object",
      "required": ["name", "tier", "sha256", "n_routes"],
      "additionalProperties": true,
      "properties": {
        "name": {"const": "smoke"},
        "tier": {"enum": ["core", "all"]},
        "path": {"type": "string"},
        "sha256": {
          "type": "string",
          "pattern": "^[0-9a-f]{64}$",
          "description": "sha256 of SMOKE_SPLIT.tsv. The harness refuses a bundle whose split hash differs from the split being checked -- comparing across splits is meaningless."
        },
        "n_routes": {"type": "integer", "minimum": 1}
      }
    },
    "reference_agent": {
      "type": "object",
      "required": ["name", "version"],
      "properties": {
        "name": {"type": "string", "examples": ["pdmlite"]},
        "version": {"type": "string", "description": "Commit, tag, or checkpoint identity. Free-form but must not be empty. make_golden.py writes '<repo name>@<full commit> <entrypoint>'.", "examples": ["carla_garage@beb3433407f42c1adced312b877a61fe04f338ba team_code/data_agent.py"]},
        "repo": {"type": "string", "description": "Optional (absent from bundles built before it existed; make_golden.py always writes it). Public https URL of the agent's repository. Never a local path.", "examples": ["https://github.com/autonomousvision/carla_garage"]},
        "commit": {"type": "string", "pattern": "^[0-9a-f]{40}$", "description": "Optional (make_golden.py always writes it). Full commit of a CLEAN checkout: make_golden.py refuses when `git status --porcelain` under the entrypoint's top directory is non-empty, because an untracked or modified file there may be what actually ran."},
        "entrypoint": {"type": "string", "description": "Optional (make_golden.py always writes it). Agent file relative to the repository root.", "examples": ["team_code/data_agent.py"]},
        "entrypoint_sha256": {"type": "string", "pattern": "^[0-9a-f]{64}$", "description": "Optional (make_golden.py always writes it). sha256 of the entrypoint file at that commit."},
        "env": {"type": ["object", "null"], "additionalProperties": {"type": "string"}, "description": "Optional (make_golden.py always writes it). The agent.env every replicate ran with, from _runner/env_provenance.json; all must agree, and make_golden.py refuses unless DATAGEN is \"0\". null when the runner that made a replicate did not record it."}
      }
    },
    "environment": {
      "type": "object",
      "required": ["carla_version", "content_pack_version"],
      "properties": {
        "carla_version": {"type": "string", "examples": ["0.9.15"]},
        "content_pack_version": {"type": "string", "examples": ["v0.9"]},
        "content_pack_sha256": {"type": ["string", "null"], "description": "Composite digest of the content pack. Rule (make_golden.py): sha256 of the canonical SHA256SUMS text built from content_pack_archives -- one line '<sha256><two spaces><archive name><LF>' per archive, sorted by archive name in byte order (LC_ALL=C sort). For a canonical sums file this equals `sha256sum SHA256SUMS`; for assets/SHA256SUMS it is exactly that. Bundles built before content_pack_archives existed carry an undocumented value here."},
        "content_pack_archives": {
          "type": "object",
          "description": "Optional (make_golden.py always writes it). Archive file name -> sha256, one entry per content-pack archive, in the order the composite rule sorts them. Source of truth: assets/SHA256SUMS.",
          "additionalProperties": {"type": "string", "pattern": "^[0-9a-f]{64}$"}
        },
        "gpu": {"type": ["string", "null"]},
        "os": {"type": ["string", "null"], "description": "Platform string of the host the replicates RAN on (Python's platform.platform()), from each replicate's _runner/report.json; all must agree. null when a replicate has no run report. Never the builder's platform, which ran no route; bundles made before make_golden.py read it from the replicates hold the builder's, which for the shipped v0.9 bundle was the same machine."},
        "python": {"type": ["string", "null"], "description": "Python version that RAN the replicates. make_golden.py reads it from each replicate's _runner/env_provenance.json (all must agree) or, failing that, from --replicate-python. Never the builder's interpreter."},
        "python_packages": {
          "type": ["object", "null"],
          "description": "Optional (make_golden.py always writes it). Versions of numpy, scipy and, if recorded, the carla client in the replicates' environment, from _runner/env_provenance.json. null when a replicate had no such file. Never a path.",
          "properties": {
            "numpy": {"type": ["string", "null"]},
            "scipy": {"type": ["string", "null"]},
            "carla": {"type": ["string", "null"]}
          }
        },
        "runner_version": {"type": ["string", "null"]}
      }
    },
    "protocol": {
      "type": "object",
      "required": ["seed", "repetitions", "n_replicates"],
      "properties": {
        "seed": {"const": 42, "description": "The published protocol is seed 42 only."},
        "repetitions": {"const": 1},
        "n_replicates": {
          "type": "integer",
          "minimum": 1,
          "description": "Independent runs of the whole split. >= 2 is required for the tolerance to be measured rather than floored; make_golden.py needs --allow-single-replicate to go below."
        }
      }
    },
    "tolerance": {
      "type": "object",
      "required": ["driving_score_abs", "policy"],
      "properties": {
        "driving_score_abs": {
          "type": "number",
          "minimum": 0,
          "description": "Absolute Driving Score tolerance for assertion A4. Required: a golden without a tolerance is a wish, not a golden."
        },
        "policy": {"type": "string", "description": "How the number above was derived, in words."},
        "max_observed_spread": {"type": "number", "minimum": 0}
      }
    },
    "generated": {
      "type": "object",
      "required": ["utc", "by"],
      "properties": {
        "utc": {"type": "string"},
        "by": {"type": "string"},
        "procedure": {"type": "string"},
        "notes": {"type": ["string", "null"]}
      }
    },
    "routes": {
      "type": "object",
      "description": "Keyed by route path relative to the canonical routes root -- the same key the split uses. Must cover every route in the split; a partial bundle is rejected, because it would silently downgrade the uncovered routes to unchecked.",
      "minProperties": 1,
      "additionalProperties": {
        "type": "object",
        "required": ["expected_blueprint_id", "observed_agent_type", "status", "driving_score", "replicates", "ds_spread"],
        "properties": {
          "route_sha256": {"type": "string", "pattern": "^[0-9a-f]{64}$"},
          "expected_blueprint_id": {
            "type": "string",
            "description": "Blueprint the route XML asks for. Re-derived from the XML at generation time, not copied from the split."
          },
          "observed_agent_type": {
            "type": "string",
            "description": "type_id of the actor that actually spawned, read from record.ttr_dar.agent_type (which is the live actor's type_id). Equal to expected_blueprint_id in any bundle make_golden.py agrees to write."
          },
          "status": {"type": "string", "examples": ["Completed", "Perfect"]},
          "driving_score": {"type": "number", "description": "Median across replicates."},
          "route_completion": {"type": ["number", "null"]},
          "infraction_penalty": {"type": ["number", "null"]},
          "replicates": {
            "type": "array",
            "minItems": 1,
            "description": "Every per-replicate observation, kept so the tolerance can be audited rather than trusted.",
            "items": {
              "type": "object",
              "required": ["replicate", "status", "driving_score"],
              "properties": {
                "replicate": {"type": "string"},
                "status": {"type": "string"},
                "driving_score": {"type": "number"},
                "route_completion": {"type": ["number", "null"]},
                "infraction_penalty": {"type": ["number", "null"]},
                "observed_agent_type": {"type": "string"}
              }
            }
          },
          "ds_spread": {"type": "number", "minimum": 0, "description": "max - min across replicates."},
          "published_seed42_driving_score": {
            "type": "number",
            "description": "Optional. From the published records, for orientation only; never gating."
          },
          "published_seed42_delta": {"type": "number"}
        }
      }
    }
  }
}
