{
  "schema": "ood-perceptionbench/golden/1",
  "bundle_version": "v0.9",
  "binds_to": "arXiv v1",
  "reportable": false,
  "split": {
    "name": "smoke",
    "tier": "all",
    "path": "SMOKE_SPLIT.tsv",
    "sha256": "dff918c375bc07a41df660d164bae00e73c85724d46618adf6e1ba042993eee4",
    "n_routes": 9
  },
  "reference_agent": {
    "name": "pdmlite",
    "version": "carla_garage@beb3433407f42c1adced312b877a61fe04f338ba team_code/data_agent.py",
    "repo": "https://github.com/autonomousvision/carla_garage",
    "commit": "beb3433407f42c1adced312b877a61fe04f338ba",
    "entrypoint": "team_code/data_agent.py",
    "entrypoint_sha256": "594e4e3a40777d55f91dc5174d993e8c42592ff23429ed5be8f0ef7662fe837a",
    "env": {
      "DATAGEN": "0",
      "PYTHON_EGG_CACHE": "/tmp/farrosalferro-egg-cache-golden_v3",
      "REPETITION": "0",
      "TOWN": "smoke"
    }
  },
  "environment": {
    "carla_version": "0.9.15",
    "content_pack_version": "v0.9",
    "content_pack_sha256": "79dcc31ac829993bc92bad7d2434318ab294c3c012ea33f5ef7370fd607de9d7",
    "content_pack_archives": {
      "ood-perceptionbench-props-v0.9.tar.gz": "30b1fa471a3068c6d070a8486fa9e169f7d89081639b14236ee11915cfdfe451",
      "ood-perceptionbench-walkers-ccby-v0.9.tar.gz": "bb07ac81bac8cff26acd28e0e942672041d8511af550c7bdc28b58b7ec7d3b67",
      "ood-perceptionbench-walkers-ccbync-v0.9.tar.gz": "0a0e4c185dc29f1536f8e02cfbdac745be9c72d911b39e4257c90b48a7a3c20a"
    },
    "gpu": "NVIDIA RTX 6000 Ada Generation, driver 570.211.01",
    "os": "Linux-6.8.0-138-generic-x86_64-with-glibc2.39",
    "python": "3.10.15",
    "python_packages": {
      "numpy": "1.23.5",
      "scipy": "1.14.1",
      "carla": "0.9.15"
    },
    "runner_version": "52f6df41db3b6f7aff39be5de70a5f0c7a739f25"
  },
  "protocol": {
    "seed": 42,
    "repetitions": 1,
    "n_replicates": 3
  },
  "tolerance": {
    "driving_score_abs": 1.0,
    "policy": "max(1.0, 2.0 x largest observed run-to-run spread). Largest spread across 3 replicate(s) was 0.0 DS points.",
    "max_observed_spread": 0.0
  },
  "generated": {
    "utc": "2026-10-05T03:38:04Z",
    "by": "tests/make_golden.py",
    "procedure": "tests/goldens/GENERATING.md",
    "notes": "environment.content_pack_sha256 = sha256 of the canonical SHA256SUMS text of environment.content_pack_archives ('<sha256>  <name>\\n' per archive, sorted by name)."
  },
  "routes": {
    "static/construction_obstacle/base/route_24795_trafficwarning.xml": {
      "route_sha256": "e7f89d918efc95291d2a1d71bf2e9c3cbcb3333a673dfbf4c425b51a0bf8095d",
      "expected_blueprint_id": "static.prop.trafficwarning",
      "observed_agent_type": "static.prop.trafficwarning",
      "status": "Completed",
      "driving_score": 100.0,
      "route_completion": 100,
      "infraction_penalty": 1.0,
      "replicates": [
        {
          "replicate": "replicate_1",
          "status": "Completed",
          "driving_score": 100.0,
          "route_completion": 100,
          "infraction_penalty": 1.0,
          "observed_agent_type": "static.prop.trafficwarning"
        },
        {
          "replicate": "replicate_2",
          "status": "Completed",
          "driving_score": 100.0,
          "route_completion": 100,
          "infraction_penalty": 1.0,
          "observed_agent_type": "static.prop.trafficwarning"
        },
        {
          "replicate": "replicate_3",
          "status": "Completed",
          "driving_score": 100.0,
          "route_completion": 100,
          "infraction_penalty": 1.0,
          "observed_agent_type": "static.prop.trafficwarning"
        }
      ],
      "ds_spread": 0.0,
      "published_seed42_driving_score": 100.0,
      "published_seed42_delta": 0.0
    },
    "static/construction_obstacle/geometric_shift/route_24795_concreteroadbarrier.xml": {
      "route_sha256": "7acc950c1d349ac20d9497e0ce5a5811ca517fa550d976d574eeff31ea239429",
      "expected_blueprint_id": "static.prop.concreteroadbarrier",
      "observed_agent_type": "static.prop.concreteroadbarrier",
      "status": "Completed",
      "driving_score": 100.0,
      "route_completion": 100,
      "infraction_penalty": 1.0,
      "replicates": [
        {
          "replicate": "replicate_1",
          "status": "Completed",
          "driving_score": 100.0,
          "route_completion": 100,
          "infraction_penalty": 1.0,
          "observed_agent_type": "static.prop.concreteroadbarrier"
        },
        {
          "replicate": "replicate_2",
          "status": "Completed",
          "driving_score": 100.0,
          "route_completion": 100,
          "infraction_penalty": 1.0,
          "observed_agent_type": "static.prop.concreteroadbarrier"
        },
        {
          "replicate": "replicate_3",
          "status": "Completed",
          "driving_score": 100.0,
          "route_completion": 100,
          "infraction_penalty": 1.0,
          "observed_agent_type": "static.prop.concreteroadbarrier"
        }
      ],
      "ds_spread": 0.0,
      "published_seed42_driving_score": 100.0,
      "published_seed42_delta": 0.0
    },
    "static/construction_obstacle/geometric_shift/route_24795_roadclosedbarricade.xml": {
      "route_sha256": "1b015b9d2d7193c431c2ef9659b9186b3dfab94453022ab6a8e6faa1d109c0d8",
      "expected_blueprint_id": "static.prop.roadclosedbarricade",
      "observed_agent_type": "static.prop.roadclosedbarricade",
      "status": "Completed",
      "driving_score": 100.0,
      "route_completion": 100,
      "infraction_penalty": 1.0,
      "replicates": [
        {
          "replicate": "replicate_1",
          "status": "Completed",
          "driving_score": 100.0,
          "route_completion": 100,
          "infraction_penalty": 1.0,
          "observed_agent_type": "static.prop.roadclosedbarricade"
        },
        {
          "replicate": "replicate_2",
          "status": "Completed",
          "driving_score": 100.0,
          "route_completion": 100,
          "infraction_penalty": 1.0,
          "observed_agent_type": "static.prop.roadclosedbarricade"
        },
        {
          "replicate": "replicate_3",
          "status": "Completed",
          "driving_score": 100.0,
          "route_completion": 100,
          "infraction_penalty": 1.0,
          "observed_agent_type": "static.prop.roadclosedbarricade"
        }
      ],
      "ds_spread": 0.0,
      "published_seed42_driving_score": 100.0,
      "published_seed42_delta": 0.0
    },
    "static/construction_obstacle/geometric_shift/route_2513_roadclosedbarricade.xml": {
      "route_sha256": "9dd57daaf6a1954998705874472a01341ecf5f0661c7d3f5526c9828c809c2ef",
      "expected_blueprint_id": "static.prop.roadclosedbarricade",
      "observed_agent_type": "static.prop.roadclosedbarricade",
      "status": "Completed",
      "driving_score": 100.0,
      "route_completion": 100,
      "infraction_penalty": 1.0,
      "replicates": [
        {
          "replicate": "replicate_1",
          "status": "Completed",
          "driving_score": 100.0,
          "route_completion": 100,
          "infraction_penalty": 1.0,
          "observed_agent_type": "static.prop.roadclosedbarricade"
        },
        {
          "replicate": "replicate_2",
          "status": "Completed",
          "driving_score": 100.0,
          "route_completion": 100,
          "infraction_penalty": 1.0,
          "observed_agent_type": "static.prop.roadclosedbarricade"
        },
        {
          "replicate": "replicate_3",
          "status": "Completed",
          "driving_score": 100.0,
          "route_completion": 100,
          "infraction_penalty": 1.0,
          "observed_agent_type": "static.prop.roadclosedbarricade"
        }
      ],
      "ds_spread": 0.0,
      "published_seed42_driving_score": 100.0,
      "published_seed42_delta": 0.0
    },
    "pedestrian/dynamic_object_crossing/base/route_24224_0001.xml": {
      "route_sha256": "89139f08bcc450439c6b679203b1f8d301a11ccba85a143b02e84b7ad26af4f1",
      "expected_blueprint_id": "walker.pedestrian.0001",
      "observed_agent_type": "walker.pedestrian.0001",
      "status": "Completed",
      "driving_score": 100.0,
      "route_completion": 100,
      "infraction_penalty": 1.0,
      "replicates": [
        {
          "replicate": "replicate_1",
          "status": "Completed",
          "driving_score": 100.0,
          "route_completion": 100,
          "infraction_penalty": 1.0,
          "observed_agent_type": "walker.pedestrian.0001"
        },
        {
          "replicate": "replicate_2",
          "status": "Completed",
          "driving_score": 100.0,
          "route_completion": 100,
          "infraction_penalty": 1.0,
          "observed_agent_type": "walker.pedestrian.0001"
        },
        {
          "replicate": "replicate_3",
          "status": "Completed",
          "driving_score": 100.0,
          "route_completion": 100,
          "infraction_penalty": 1.0,
          "observed_agent_type": "walker.pedestrian.0001"
        }
      ],
      "ds_spread": 0.0,
      "published_seed42_driving_score": 100.0,
      "published_seed42_delta": 0.0
    },
    "pedestrian/dynamic_object_crossing/visual_shift/route_24224_astronaut.xml": {
      "route_sha256": "b1b5b4c10554fc39cedecb06cfd9582f4a9b1da9d5fe88a79badca656e35a83c",
      "expected_blueprint_id": "walker.pedestrian.astronaut",
      "observed_agent_type": "walker.pedestrian.astronaut",
      "status": "Completed",
      "driving_score": 100.0,
      "route_completion": 100,
      "infraction_penalty": 1.0,
      "replicates": [
        {
          "replicate": "replicate_1",
          "status": "Completed",
          "driving_score": 100.0,
          "route_completion": 100,
          "infraction_penalty": 1.0,
          "observed_agent_type": "walker.pedestrian.astronaut"
        },
        {
          "replicate": "replicate_2",
          "status": "Completed",
          "driving_score": 100.0,